benchmark_version	semantic_scope	timing_mode	timing_policy	timing_unit	timing_runs	primitive	backend_variant	steps	relation	serialized_bytes	derive_ms	verify_ms	verified	note
stwo-phase43-source-root-feasibility-benchmark-v2	phase43_emitted_source_boundary_feasibility_calibration	measured_median	median_of_5_runs_from_microsecond_capture	milliseconds	5	phase43_proof_native_source_boundary	emitted_source_boundary_plus_compact_projection	2	one emitted Phase43 proof-native source boundary plus one compact Phase43 projection proof	61349	0.000	0.857	True	real emitted-surface row: the verifier accepts the emitted Phase43 proof-native source boundary against the same compact proof without the full trace or the Phase30 manifest; this measures verifier-side replay elimination, not faster FRI verification; boundary construction cost is tracked separately in the benchmark and excluded from verifier-side totals
stwo-phase43-source-root-feasibility-benchmark-v2	phase43_emitted_source_boundary_feasibility_calibration	measured_median	median_of_5_runs_from_microsecond_capture	milliseconds	5	phase43_proof_native_source_boundary	full_trace_plus_phase30_derivation_baseline	2	derive the Phase43 source-root claim from full Phase43 trace plus Phase30 manifest, then verify one compact Phase43 projection proof	71436	0.434	0.611	True	baseline row: pays the exact source-root derivation work the verifier would still need without the emitted proof-native Phase43 source boundary
stwo-phase43-source-root-feasibility-benchmark-v2	phase43_emitted_source_boundary_feasibility_calibration	measured_median	median_of_5_runs_from_microsecond_capture	milliseconds	5	phase43_compact_projection_proof	compact_phase43_projection_proof_only	2	one compact Phase43 projection proof envelope	54939	0.000	0.361	True	causal decomposition row: verifies only the compact Phase43 projection proof that both feasibility variants already depend on
stwo-phase43-source-root-feasibility-benchmark-v2	phase43_emitted_source_boundary_feasibility_calibration	measured_median	median_of_5_runs_from_microsecond_capture	milliseconds	5	phase43_source_root_claim_derivation	derive_source_root_claim_only	2	derive the Phase43 source-root claim from the full Phase43 trace plus Phase30 manifest	16497	0.434	0.000	True	causal decomposition row: isolates the local full-trace and Phase30 work that would disappear only after a source-emission patch
stwo-phase43-source-root-feasibility-benchmark-v2	phase43_emitted_source_boundary_feasibility_calibration	measured_median	median_of_5_runs_from_microsecond_capture	milliseconds	5	phase43_proof_native_source_boundary	source_boundary_binding_only	2	bind one emitted Phase43 proof-native source boundary to a previously verified compact Phase43 projection claim	6410	0.000	0.160	True	causal decomposition row: assumes the compact proof was already verified and measures only the emitted boundary binding acceptance surface
