route_id	route_kind	status	cryptographic_backend	usable_today	claim_boundary	blocking_missing_object	next_action
source_proof_native_two_slice_contract	source_contract_available	GO_INPUT_CONTRACT_ONLY_NOT_CRYPTOGRAPHIC_BACKEND	False	True	PROOF_NATIVE_TRANSCRIPT_COMPRESSION_NOT_RECURSION	none_for_source_contract	use as the exact public-input contract a real backend must prove or receipt
local_stwo_nested_verifier_backend	local_stwo_native_recursion	NO_GO_MISSING_NESTED_VERIFIER_AIR_OR_CIRCUIT	True	False	missing_executable_backend	src/stwo_backend/d128_two_slice_recursive_pcd_backend.rs	design or import a verifier-in-AIR/circuit that proves the selected d128 slice verifier checks
local_pcd_or_ivc_outer_proof_backend	local_pcd_or_ivc_backend	NO_GO_MISSING_OUTER_PROOF_GENERATOR_AND_VERIFIER_HANDLE	True	False	missing_executable_backend	recursive_or_pcd_outer_proof_generator_and_verifier_handle	add an executable PCD/IVC backend and bind the #424 public-input contract
external_zkvm_statement_receipt_backend	external_zkvm_statement_receipt	GO_EXTERNAL_RISC0_STATEMENT_RECEIPT_BACKEND_FOR_D128_CONTRACT	True	True	RISC0_STATEMENT_RECEIPT_BINDS_D128_TWO_SLICE_JOURNAL_NOT_RECURSION	none_for_external_risc0_statement_receipt	use as proof-system-independent zkVM statement-receipt control; do not claim recursion
external_snark_or_ivc_statement_receipt_backend	external_snark_or_ivc_statement_receipt	GO_EXTERNAL_SNARK_STATEMENT_RECEIPT_BACKEND_FOR_D128_CONTRACT	True	True	external_snark_statement_receipt_not_recursion	none_for_external_snark_statement_receipt	use as proof-system-independent statement-receipt control; compare against the #433 zkVM receipt without treating either as recursion
starknet_settlement_adapter	settlement_adapter	DEFERRED_UNTIL_A_PROOF_OBJECT_EXISTS	False	False	deployment_adapter_after_backend_proof_object	proof_object_suitable_for_settlement_facts	keep parked until a local or external proof object exists for the same public-input contract
