row_id	surface	status	object_class	rows	bytes	ratio_vs_nanozk_reported	can_support_native_claim	claim_boundary
full_d128_verifier_accumulator	six-slice d128 verifier-facing accumulator	GO_D128_FULL_BLOCK_VERIFIER_ACCUMULATOR_NOT_OUTER_PROOF	non_recursive_verifier_accumulator	197504			False	binds receipts and public inputs; does not prove slice verifiers inside an outer proof
two_slice_outer_proof_target	smallest d128 two-slice outer proof target	NO_GO_EXECUTABLE_TWO_SLICE_OUTER_PROOF_OBJECT_MISSING	missing_native_outer_proof_object	256			False	the smaller two-slice target is already blocked before proof metrics
attention_derived_outer_input_contract	attention-derived d128 compressed outer-proof input contract	GO_ATTENTION_DERIVED_D128_OUTER_PROOF_INPUT_CONTRACT_NOT_OUTER_PROOF	checked_input_contract_not_proof	199553	2559	0.37087	False	compressed transcript and input contract; not proof-size evidence
external_package_without_vk	external verifier-facing package without reusable VK	GO_COMPACT_VERIFIER_FACING_PACKAGE_NOT_NATIVE_PROOF	external_statement_package_not_native_proof		4752	0.688696	False	compact package signal only; object class differs from NANOZK block proof row
native_d128_block_proof_object	single native or matched d128 transformer-block proof object	NO_GO_EXECUTABLE_NATIVE_D128_BLOCK_OUTER_PROOF_BACKEND_MISSING	missing_required_native_proof_object				False	required before native proof-size, timing, or matched NANOZK claims
external_nanozk_context	NANOZK paper-reported transformer block proof row	SOURCE_BACKED_EXTERNAL_CONTEXT_NOT_LOCALLY_REPRODUCED	paper_reported_external_proof_row		6900	1.0	False	external context row only; not reproduced locally and not matched workload evidence
