route_id	route_kind	status	usable_today	claim_boundary	next_action	blocking_missing_object
local_stwo_nested_verifier_air	local_stwo_native_recursion	NO_GO_MISSING_NESTED_VERIFIER_AIR	False	missing_executable_backend	design or import a verifier-in-AIR/circuit for the two selected d128 slice verifiers	src/stwo_backend/d128_two_slice_recursive_pcd_backend.rs
local_stwo_pcd_outer_proof	local_stwo_or_pcd_backend	NO_GO_MISSING_OUTER_PCD_PROOF_SYSTEM	False	missing_executable_backend	add a PCD/IVC backend that proves the selected verifier checks and binds the same public inputs	recursive_or_pcd_outer_proof_generator_and_verifier_handle
local_two_slice_non_recursive_accumulator	local_pre_recursive_accumulator	GO_PRE_RECURSIVE_INTEGRITY_ONLY	True	NON_RECURSIVE_ACCUMULATOR_NOT_OUTER_PROOF	keep as source-bound handoff object; do not report recursive metrics from it	none_for_accumulator_integrity
local_full_block_non_recursive_accumulator	local_pre_recursive_accumulator	GO_PRE_RECURSIVE_INTEGRITY_ONLY	True	NON_RECURSIVE_ACCUMULATOR_NOT_OUTER_PROOF	keep as the strongest local statement-bound d128 handoff object	none_for_accumulator_integrity
proof_native_two_slice_compression_without_recursion	local_non_recursive_compression_spike	RESEARCH_SPIKE_CANDIDATE_NOT_YET_GO	False	future_proof_native_compression_not_recursion	try one proof-native object for the two-slice transcript, explicitly not recursive aggregation	proof_native_two_slice_compression_artifact
external_zkvm_statement_receipt_adapter	external_recursion_capable_adapter	RESEARCH_SPIKE_CANDIDATE_NOT_YET_GO	False	external_adapter_result_until_local_stwo_recursion_exists	map the exact two-slice statement into a zkVM receipt adapter and test relabeling	checked_external_zkvm_receipt_for_d128_two_slice_contract
external_snark_or_ivc_statement_adapter	external_snark_or_ivc_adapter	RESEARCH_SPIKE_CANDIDATE_NOT_YET_GO	False	external_adapter_result_not_stwo_native	test whether a SNARK/IVC receipt can bind the same d128 two-slice statement contract	checked_external_snark_or_ivc_receipt_for_d128_two_slice_contract
starknet_settlement_adapter	settlement_adapter	DEFERRED_UNTIL_LOCAL_OR_EXTERNAL_PROOF_OBJECT_EXISTS	False	deployment_adapter_after_proof_object	do not prioritize until one proof object exists for the same public-input contract	proof_object_suitable_for_settlement_facts
